{
  "$schema": "../../schemas/project-target.schema.json",
  "version": 1,
  "githubOrganization": "ORESoftware",
  "supabaseOrganization": {
    "id": "zmkmcdyrryxxhleytdho",
    "name": "oresoftware"
  },
  "project": {
    "ref": "sznvdzulwlaghrrpiebd",
    "slug": "multi-app-3fa-app",
    "status": "active",
    "region": "us-east-1",
    "environment": "production",
    "canonical": true
  },
  "contractSource": {
    "repository": "3FA-app/3fa-lib-core",
    "branch": "main",
    "authorityTier": "lib-core",
    "state": "partial",
    "rootDirectory": ".",
    "sqlDesiredState": null,
    "jsonSchemaDirectory": null
  },
  "providerOverlay": {
    "repository": "ORESoftware/ores-supabase",
    "branch": "main",
    "workingDirectory": "projects/sznvdzulwlaghrrpiebd",
    "supabaseDirectory": "projects/sznvdzulwlaghrrpiebd/supabase",
    "migrationsDirectory": "projects/sznvdzulwlaghrrpiebd/supabase/migrations",
    "functionsDirectory": "projects/sznvdzulwlaghrrpiebd/supabase/functions",
    "configPath": "projects/sznvdzulwlaghrrpiebd/supabase/config.toml"
  },
  "gitIntegration": {
    "provider": "supabase-github-app",
    "state": "planned",
    "automaticBranching": false,
    "supabaseChangesOnly": true,
    "deployToProduction": false,
    "verifiedAt": null,
    "branchProtection": {
      "state": "pending",
      "requiredCheck": "validate",
      "verifiedAt": null
    },
    "providerReadback": {
      "state": "pending",
      "verifiedAt": null
    }
  },
  "baseline": {
    "state": "pending",
    "method": "supabase-db-pull",
    "migrationHead": null,
    "sourceCommit": null,
    "verifiedAt": null
  },
  "databaseAlignment": {
    "relationship": "controlled-drift",
    "peer": "aws-rds-postgres",
    "convergence": "explicit-only",
    "migrationEngine": "declarative-migrations/declarative-postgres-migrate.rs",
    "registry": "ORESoftware/k8s-libs-and-shared-defs"
  },
  "dependencies": {
    "apiContracts": "ORESoftware/api-docs",
    "authenticationOrganization": "shared-auth",
    "syncOrganization": "opto-sync"
  }
}
